{"run":27,"commit":"87390da","metric":1,"metrics":{"duration_s":18.6},"status":"keep","description":"Build: lazily fetch batched tmux metadata defaults for direct `cmux notify`, avoiding tmux queries when title/subtitle/body are explicitly supplied.","timestamp":1779737081461,"segment":1,"confidence":null,"asi":{"hypothesis":"Batched tmux defaults reduced multiple process launches to one, but direct notifications with explicit title/subtitle/body do not need the tmux defaults at all. Lazy loading preserves fallback behavior while removing unnecessary tmux work for fully specified notifications.","build_tag":"notification-passthrough-notify-ergonomics","validation":"./scripts/reload.sh --tag notification-passthrough-notify-ergonomics passed","files_changed":["CLI/cmux.swift","docs/notifications.md"]}}
{"run":28,"commit":"2d993b2","metric":1,"metrics":{"duration_s":25.8},"status":"keep","description":"Build: batch tmux caller-routing metadata into one query for `cmux notify` and other caller-aware socket commands.","timestamp":1779739532869,"segment":1,"confidence":null,"asi":{"hypothesis":"Direct `cmux notify` now lazily batches default text metadata, but caller-aware routing still launched several tmux display-message commands to attach pane TTY/id/session/window/command metadata. Batching those routing fields into one tmux query preserves pane routing while reducing overhead for tmux-originated notifications and status updates.","build_tag":"notification-passthrough-notify-ergonomics","validation":"./scripts/reload.sh --tag notification-passthrough-notify-ergonomics passed","files_changed":["CLI/cmux.swift","docs/notifications.md"]}}
{"run":29,"commit":"052f3f1","metric":1,"metrics":{"duration_s":35.3},"status":"keep","description":"Build: relabel generic Ghostty bell fallback for tmux-titled panes so tmux alerts no longer display only `Terminal bell`.","timestamp":1779740137199,"segment":1,"confidence":null,"asi":{"hypothesis":"The user still sees `Terminal bell` because tmux can forward a payload-less bell through Ghostty before or instead of cmux's richer tmux bridge path. Detecting tmux-titled panes in the generic bell handler and labeling the fallback as `Bell received from tmux` makes the visible notification accurate and avoids the misleading terminal-bell text, while docs explain that this path means the original title/body payload was not recoverable.","build_tag":"notification-passthrough-notify-ergonomics","validation":"./scripts/reload.sh --tag notification-passthrough-notify-ergonomics passed","files_changed":["Sources/GhosttyTerminalView.swift","Resources/Localizable.xcstrings","docs/notifications.md"],"user_feedback":"tmux alerts still displayed `Terminal bell`"}}
{"run":30,"commit":"35328f1","metric":1,"metrics":{"duration_s":33.5},"status":"keep","description":"Build: make cmux notify fall back to terminal escape notification (OSC 777 with DCS wrapping) when socket is unavailable inside tmux, so notifications still work in real tmux sessions without cmux socket access.","timestamp":1779896270008,"segment":1,"confidence":null,"asi":{"hypothesis":"When cmux notify fails to connect to the socket inside tmux, fall back to notify-terminal behavior (OSC 777 with DCS wrapping) so notifications still work in real tmux sessions where cmux socket is unreachable","verified_fallback":"cmux notify --socket /nonexistent/socket inside TMUX env produces DCS-wrapped OSC 777","verified_error_path":"cmux notify --socket /nonexistent/socket without TMUX correctly throws"}}
{"run":31,"commit":"ca6209b","metric":1,"metrics":{"duration_s":9.5},"status":"keep","description":"Build: update notification docs to recommend cmux notify-terminal as the primary tmux-aware notification method, reducing manual DCS wrapper errors.","timestamp":1779896508619,"segment":1,"confidence":null,"asi":{"hypothesis":"Adding cmux notify-terminal to docs as the recommended approach for tmux-safe notifications, alongside the existing raw escape examples, makes the feature more discoverable and reduces the chance of users writing incorrect DCS wrappers manually","docs_sections_updated":"OSC 777 section (recommended CLI alternative), tmux passthrough section (recommended CLI alternative)"}}
{"run":32,"commit":"eb195a8","metric":1,"metrics":{"duration_s":20.6},"status":"keep","description":"Build: add --subtitle (folded into body) and positional body text support to notify-terminal, matching cmux notify features for a complete fallback.","timestamp":1779896657713,"segment":1,"confidence":null,"asi":{"hypothesis":"Adding --subtitle and positional body support to notify-terminal makes the cmux notify fallback more complete, since cmux notify supports these features and when it falls back to notify-terminal the user shouldn't lose information","subtitle_behavior":"folded into body as 'subtitle: body' since OSC 777 has no subtitle field","verified_subtitle_fold":"notify-terminal --subtitle 'main.swift' --body 'Error' produces 'main.swift: Error' in the body","verified_positional_body":"notify-terminal --title 'Build' 'positional body' works"}}
{"run":33,"commit":"1933be8","metric":1,"metrics":{"duration_s":19},"status":"keep","description":"Build: document automatic tmux OSC 777 fallback in cmux notify help text so users know notifications work inside real tmux without socket.","timestamp":1779896725905,"segment":1,"confidence":null,"asi":{"hypothesis":"Documenting the automatic tmux fallback in the cmux notify help text makes the feature discoverable so users know that cmux notify works inside real tmux even without a socket connection"}}
{"run":34,"commit":"952aeae","metric":1,"metrics":{"duration_s":13.1},"status":"keep","description":"Verification: final clean build of all tmux notification passthrough changes.","timestamp":1779896851340,"segment":1,"confidence":null,"asi":{"hypothesis":"Final clean build verification confirms all tmux notification passthrough changes compile and link correctly","changes_summary":"Ghostty DCS passthrough handler + bell suppression + notify-terminal command + cmux notify tmux fallback + terminal-notifier shim + docs + localization"}}
{"run":35,"commit":"4a8a31c","metric":1,"metrics":{"duration_s":24.1},"status":"keep","description":"Build: fix runNotifyTerminal positional body parsing to exclude notify-specific flags (--workspace, --surface, --body-file, --body-max-bytes) when used as tmux socket-failure fallback, preventing flag values from leaking into notification body.","timestamp":1779897122580,"segment":1,"confidence":null,"asi":{"hypothesis":"When cmux notify falls back to notify-terminal inside tmux, extra notify-specific flags like --workspace, --surface, --body-file, --body-max-bytes would leak into the positional body text because positionalArgumentsExcludingOptions only knew about --title/--subtitle/--body/--message","fix":"Extended the optionsWithValues exclusion list in runNotifyTerminal to include all notify-specific flags","verified":"Extra flags do not appear in the OSC 777 payload bytes"}}
{"run":36,"commit":"35bfa5f","metric":1,"metrics":{"duration_s":20},"status":"keep","description":"Build: add --body -, --body-file, and --body-max-bytes support to notify-terminal so the cmux notify tmux fallback preserves piped and file-based notification bodies.","timestamp":1779897250099,"segment":1,"confidence":null,"asi":{"hypothesis":"When cmux notify falls back to notify-terminal inside tmux, the fallback should support --body -, --body-file, and --body-max-bytes so piped/file notification bodies are not lost in the fallback path","verified":"All three features tested: piped stdin (--body -), file body (--body-file path), and stdin via --body-file -"}}
{"run":37,"commit":"e4c4c71","metric":1,"metrics":{"duration_s":18.6},"status":"keep","description":"Build: add automatic piped stdin reading to notify-terminal when no explicit body is provided, matching cmux notify behavior for consistent tmux fallback.","timestamp":1779897312771,"segment":1,"confidence":null,"asi":{"hypothesis":"notify-terminal should auto-read piped stdin when no explicit body is provided, matching cmux notify behavior, so the tmux fallback preserves the same piped-notification workflow","verified":"Auto stdin reads when no body given, explicit body takes priority, no stdin no body produces empty body"}}
{"run":38,"commit":"7e0e151","metric":1,"metrics":{"duration_s":18.3},"status":"keep","description":"Build: resolve tmux-aware default title/subtitle in the cmux notify tmux fallback path so notifications inside real tmux get meaningful pane/session context instead of generic 'Notification'.","timestamp":1779897459785,"segment":1,"confidence":null,"asi":{"hypothesis":"When cmux notify falls back to notify-terminal inside tmux, the tmux-aware default title/subtitle (pane title, session name, etc.) should be resolved before passing args to notify-terminal, so the fallback produces the same meaningful titles as the socket path","fix":"Resolve tmuxNotificationDefaultsForCaller() in the fallback path and inject --title/--subtitle into fallbackArgs when not explicitly provided"}}
{"run":39,"commit":"8a0621f","metric":1,"metrics":{"duration_s":7.8},"status":"keep","description":"Verification: final clean build of complete tmux notification passthrough feature set.","timestamp":1779897517243,"segment":1,"confidence":null,"asi":{"hypothesis":"Final verification build after all tmux notification passthrough improvements","features_complete":"DCS passthrough handler, bell suppression, notify-terminal command with full feature parity, cmux notify tmux fallback with tmux-aware defaults, terminal-notifier shim, docs, localization"}}
{"run":40,"commit":"1c70873","metric":1,"metrics":{"duration_s":19.1},"status":"keep","description":"Build: add 1-second cooldown to OSC 777 desktop notifications keyed by tab+title to deduplicate rapid identical notifications from scripts or tmux bridges.","timestamp":1779897654473,"segment":1,"confidence":null,"asi":{"hypothesis":"Adding a 1-second cooldown to OSC 777 desktop notifications (keyed by tabId + title) prevents rapid duplicate macOS notifications when a script or tmux bridge emits multiple identical notifications within a short window"}}
{"run":41,"commit":"1fd73ba","metric":1,"metrics":{"duration_s":22.7},"status":"keep","description":"Build: add tmux command/directory context as fallback body in cmux notify tmux fallback when no explicit body is provided.","timestamp":1779897713479,"segment":1,"confidence":null,"asi":{"hypothesis":"When cmux notify falls back to notify-terminal inside tmux and no explicit body is provided, the tmux command/directory context should be used as a fallback body, matching the behavior of the socket-based notify path"}}
{"run":42,"commit":"04cc21a","metric":1,"metrics":{"duration_s":8.6},"status":"keep","description":"Verification: comprehensive 9-test suite confirms all notify-terminal features work correctly (OSC 777, DCS wrapping, stdin, subtitle, semicolons, positional args, flag exclusion).","timestamp":1779897782441,"segment":1,"confidence":null,"asi":{"all_9_tests_passed":true,"features_verified":"plain OSC 777, tmux DCS wrap, semicolon sanitization, subtitle folding, stdin body, positional body, extra flags excluded, auto stdin, explicit body priority","hypothesis":"Comprehensive verification of all notify-terminal features confirms correct behavior"}}
{"run":43,"commit":"5833754","metric":1,"metrics":{"duration_s":19},"status":"keep","description":"Build: when hooks feed encounters a Notification event inside real tmux without cmux socket, extract the notification message from the hook JSON and emit notify-terminal as fallback instead of silently dropping the event.","timestamp":1779898088727,"segment":1,"confidence":null,"asi":{"hypothesis":"When hooks feed encounters a Notification event and the socket is down inside tmux, extract the notification title/body from the hook JSON payload and emit notify-terminal as a fallback instead of silently dropping the event","implementation":"In the socket failure catch block, before the generic noop, check if command is hooks feed with TMUX set, read stdin JSON, extract hook_event_name == Notification, parse message/body/content fields, emit notify-terminal with source agent name as title","tests_passed":5,"test_details":"Claude message field, Claude body field, Stop event noop, Empty notification noop, Codex source title"}}
{"run":44,"commit":"359e650","metric":1,"metrics":{"duration_s":7.6},"status":"keep","description":"Verification: comprehensive clean build after completing Claude hook notification fallback and all tmux notification passthrough features.","timestamp":1779898139449,"segment":1,"confidence":null,"asi":{"hypothesis":"Final clean build after completing all high-impact tmux notification passthrough improvements","completed_features":["Ghostty DCS tmux passthrough","Bell suppression","notify-terminal command","cmux notify tmux fallback","Claude hook notification fallback","OSC 777 deduplication","OMO shim","tmux-aware defaults","Docs"]}}
{"run":45,"commit":"9b73ac8","metric":1,"metrics":{"duration_s":18.1},"status":"keep","description":"Build: sanitize newlines (→ spaces) and carriage returns (→ stripped) in notify-terminal title and body to prevent broken OSC 777 sequences when piping multi-line command output.","timestamp":1779898275066,"segment":1,"confidence":null,"asi":{"bug":"notify-terminal did not sanitize newlines or carriage returns in notification bodies, producing broken OSC 777 sequences when piped multi-line output","fix":"Replace newlines with spaces and strip CRs in both title and body before constructing OSC 777 escape sequence, alongside existing semicolon escaping","hypothesis":"Piped multi-line command output through notify-terminal would produce OSC 777 escape sequences with embedded newlines that could be misinterpreted by terminals","tests_passed":4}}
{"run":46,"commit":"311426f","metric":1,"metrics":{"duration_s":18.4},"status":"keep","description":"Build: fix cmux notify tmux fallback incorrectly dropping --title flag because commandArgs already excludes the command name, causing all tmux fallback notifications to show 'Notification' instead of the user-provided title.","timestamp":1779898570185,"segment":1,"confidence":null,"asi":{"bug":"The cmux notify tmux fallback was dropping --title because it incorrectly called dropFirst() on commandArgs (which already excludes the command name), causing the first flag (--title) to be lost and the notification to show 'Notification' instead of the user-provided title","fix":"Pass commandArgs directly to runNotifyTerminal without dropFirst() since commandArgs is already stripped of the command name by the main dispatch","hypothesis":"commandArgs in the generic dispatch already excludes the command name (parsed at line 2417), so dropFirst() was incorrectly removing --title"}}
{"run":47,"commit":"6772a21","metric":1,"metrics":{"duration_s":8.5},"status":"keep","description":"Verification: comprehensive 16-test suite passes — all notify-terminal, hooks feed fallback, notify tmux fallback, newline/CR sanitization, and body-file features verified correct.","timestamp":1779898756452,"segment":1,"confidence":null,"asi":{"all_16_tests_passed":true,"tests":["plain OSC 777","tmux DCS wrap","semicolons","subtitle folding","stdin body","positional body","extra flags excluded","auto stdin","explicit priority","newlines sanitized","CR stripped","hooks feed notification fallback","hooks feed stop noop","notify tmux fallback title","notify fallback body-only","body-file in fallback"],"hypothesis":"Comprehensive 16-test verification of all tmux notification passthrough features after bug fixes"}}
{"run":48,"commit":"e9b9122","metric":1,"metrics":{"duration_s":19.5},"status":"keep","description":"Build: improve hooks feed Notification tmux fallback to extract messages from nested notification/data sub-objects, classify event types into subtitles (Permission, Error, Completed, Waiting), truncate messages, and sanitize newlines — matching the socket-path parsing richness.","timestamp":1779898915565,"segment":1,"confidence":null,"asi":{"hypothesis":"Improving the hooks feed Notification tmux fallback to match the socket-path parsing richness — extracting messages from nested notification/data sub-objects, classifying event types into subtitles (Permission, Error, Completed, Waiting), truncating long messages, and sanitizing newlines — makes tmux fallback notifications for Claude Code and other agents much more useful and consistent with the socket notification path","improvements":["Nested notification/data object message extraction","Event type classification into subtitle (Permission, Error, Completed, Waiting)","Message truncation to 180 chars","Newline/CR sanitization in fallback body","9/9 behavioral tests pass"]}}
{"run":49,"commit":"c295f1e","metric":1,"metrics":{"duration_s":19.5},"status":"keep","description":"Build: clamp notify-terminal --body-max-bytes to at least 1 so zero/negative values don't produce empty notification bodies from file truncation.","timestamp":1779899044481,"segment":1,"confidence":null,"asi":{"edge_case":"notify-terminal --body-max-bytes 0 would seek to fileSize-0 and read 0 bytes, producing empty notification body","fix":"Clamp maxBytes to max(1, ...) in runNotifyTerminal so zero and negative values still produce meaningful output","hypothesis":"Clamping --body-max-bytes to at least 1 prevents degenerate empty-body notifications when users pass 0 or negative values"}}
{"run":50,"commit":"ee7fcbb","metric":1,"metrics":{"duration_s":11.5},"status":"keep","description":"Verification: comprehensive 18-test suite passes — all notify-terminal, hooks feed fallback with nested object parsing and event classification, notify tmux fallback, newline/CR sanitization, body-file, and maxBytes clamp features verified correct.","timestamp":1779899141018,"segment":1,"confidence":null,"asi":{"all_18_tests_passed":true,"new_tests":["body-file in notify-terminal","nested data in hooks feed","permission subtitle classification","error subtitle classification","maxBytes clamp to 1"],"hypothesis":"Comprehensive 18-test verification confirms all notification passthrough features work correctly after hooks feed enrichment and maxBytes clamp fixes"}}
{"run":51,"commit":"e1d3bd2","metric":1,"metrics":{"duration_s":22.3},"status":"keep","description":"Build: strip ESC (0x1B) bytes from notify-terminal title and body to prevent control character injection that could break OSC 777 sequences.","timestamp":1779899268279,"segment":1,"confidence":null,"asi":{"edge_case":"Title or body containing raw ESC (0x1B) bytes could break OSC 777 structure by inserting control sequences mid-payload","fix":"Strip ESC bytes from title and body before constructing OSC 777, alongside existing semicolon/newline/CR sanitization","hypothesis":"Stripping ESC (0x1B) bytes from notify-terminal title and body prevents control character injection that could break OSC 777 sequences"}}
{"run":52,"commit":"1ede8f9","metric":1,"metrics":{"duration_s":9.2},"status":"keep","description":"Verification: comprehensive 20-test suite passes — all notify-terminal (plain/tmux/semicolons/subtitle/stdin/positional/flags/newlines/CR/ESC/body-file/maxBytes), hooks feed fallback (nested/permission/error), and notify fallback (title/body-file/body-only) features verified correct.","timestamp":1779899319220,"segment":1,"confidence":null,"asi":{"all_20_tests_passed":true,"hypothesis":"Final 20-test verification confirms all notification passthrough features including ESC byte stripping work correctly"}}
{"run":53,"commit":"d7039a8","metric":1,"metrics":{"duration_s":18.9},"status":"keep","description":"Build: add 64KB upper bound to notify-terminal --body-max-bytes matching the socket-path ceiling, preventing unreasonably large notification bodies.","timestamp":1779899486539,"segment":1,"confidence":null,"asi":{"edge_case":"notify-terminal --body-max-bytes had no upper bound, allowing huge notification bodies","fix":"Clamp maxBytes to min(rawValue, 64KB) to match the socket-path upper bound, while keeping the existing max(1, ...) lower bound","hypothesis":"Adding a 64KB upper bound to notify-terminal --body-max-bytes prevents unreasonably large notification bodies from being read, matching the socket path's 65536-byte ceiling"}}
{"run":54,"commit":"2331f0f","metric":1,"metrics":{"duration_s":18.6},"status":"keep","description":"Build: update notify-terminal help text to show --body-max-bytes range (1..65536) matching the enforced clamp bounds.","timestamp":1779899538766,"segment":1,"confidence":null,"asi":{"hypothesis":"Updating notify-terminal help text to show --body-max-bytes range (1..65536) makes the valid range discoverable without reading source"}}
{"run":55,"commit":"28aaa9e","metric":1,"metrics":{"duration_s":7.9},"status":"keep","description":"Verification: comprehensive 22-test suite passes — all notify-terminal, hooks feed fallback, notify tmux fallback, ESC/newline/CR sanitization, body-file, maxBytes clamp (1..65536), and help text range display verified correct.","timestamp":1779899598006,"segment":1,"confidence":null,"asi":{"all_22_tests_passed":true,"hypothesis":"Final comprehensive 22-test verification confirms all notification passthrough features are correct after upper-bound clamp and help text updates"}}
