{"run":56,"commit":"f5bd211","metric":1,"metrics":{"duration_s":19.6},"status":"keep","description":"Build: align deep hooks feed Notification fallback with early-dispatch handler — extract messages from nested notification/data sub-objects, truncate to 180 chars, sanitize newlines.","timestamp":1779899815584,"segment":1,"confidence":null,"asi":{"edge_case":"The deep hooks feed Notification fallback (inside tmux-compat shouldNoopTmuxOnlyHook) only checked top-level message/body/content keys, missing nested notification/data sub-objects that the early-dispatch handler already handles","fix":"Align both Notification fallback paths to use the same nested extraction logic: check notification and data sub-objects, try message/body/text/error/description/content in both scopes, truncate to 180 chars, and sanitize newlines/CR","hypothesis":"Making the deep hooks feed Notification fallback use the same nested data extraction as the early-dispatch handler ensures Claude Code notifications with nested payload structures are correctly extracted regardless of which code path handles them"}}
{"run":57,"commit":"3d4ce0f","metric":1,"metrics":{"duration_s":7.9},"status":"keep","description":"Verification: comprehensive 24-test suite passes — all notify-terminal, hooks feed fallback (early+deep nested extraction), notify tmux fallback, ESC/newline/CR sanitization, body-file, maxBytes clamp verified correct.","timestamp":1779899867220,"segment":1,"confidence":null,"asi":{"all_24_tests_passed":true,"hypothesis":"Comprehensive 24-test verification confirms all notification passthrough features including deep nested extraction in both fallback paths work correctly"}}
{"run":58,"commit":"a68aa3b","metric":1,"metrics":{"duration_s":18.2},"status":"keep","description":"Build: add subtitle classification (Permission/Error/Completed/Waiting) to deep hooks feed Notification fallback, matching early-dispatch handler behavior.","timestamp":1779899931963,"segment":1,"confidence":null,"asi":{"fix":"Added subtitle classification (Permission/Error/Completed/Waiting) to the deep hooks feed Notification fallback, matching the early-dispatch handler","hypothesis":"Both hooks feed Notification fallback paths now use identical subtitle classification logic for consistent notification categorization regardless of which code path handles them"}}
{"run":59,"commit":"e034620","metric":1,"metrics":{"duration_s":7.6},"status":"keep","description":"Verification: comprehensive 25-test suite passes — all notify-terminal, hooks feed fallback (early+deep with subtitle classification), notify tmux fallback, ESC/newline/CR sanitization, body-file verified correct.","timestamp":1779899983335,"segment":1,"confidence":null,"asi":{"all_25_tests_passed":true,"hypothesis":"Final 25-test verification confirms all notification passthrough features including deep nested extraction with subtitle classification work correctly across all code paths"}}
{"run":60,"commit":"8c7f6b5","metric":1,"metrics":{"duration_s":8.4},"status":"keep","description":"Verification: comprehensive 26-test suite passes — all notify-terminal, hooks feed fallback (early+deep with nested extraction and subtitle classification), notify tmux fallback, ESC/newline/CR sanitization, body-file, maxBytes clamp, and truncation verified correct. Code review confirms feature completeness.","timestamp":1779900221118,"segment":1,"confidence":null,"asi":{"all_26_tests_passed":true,"code_review_completed":true,"findings":["shellQuote uses safe single-quote escaping","tmux-bridge handler properly classifies bell/silence/activity events with localized strings","tmux-bridge fallback correctly no-ops in real tmux (escape bytes would be captured by tmux stdout)","notify fallback correctly passes --body-file and --body-max-bytes through to runNotifyTerminal","help texts are consistent and document tmux fallback behavior","Localizable.xcstrings has both en and ja translations for all new strings"],"hypothesis":"Comprehensive code review and 26-test verification confirms the tmux notification passthrough feature is complete, consistent, and well-documented"}}
{"run":61,"commit":"b9557d8","metric":1,"metrics":{"duration_s":8},"status":"keep","description":"Verification: comprehensive 26-test suite passes — all notify-terminal, hooks feed fallback (early+deep with nested extraction and subtitle classification), notify tmux fallback, ESC/newline/CR sanitization, body-file, maxBytes clamp, and truncation verified correct. Code review confirms feature completeness.","timestamp":1779900426566,"segment":1,"confidence":null,"asi":{"all_edge_cases_verified":true,"feature_complete":true,"findings":["OMX/OMC do not use terminal-notifier (not installed) - shim idea is speculative","tmux-bridge early no-op is correct - tmux run-shell captures stdout so terminal escapes would never reach Ghostty","cmux notify stdin is NOT consumed before tmux fallback fires - socket connect fails before body reading","Codex-style 'event' key and Claude-style 'hook_event_name' both handled in hooks feed fallback","All paths verified: notify-terminal (13 tests), hooks feed (10 tests), notify fallback (3 tests)"],"hypothesis":"Comprehensive code review and 26-test verification confirms the tmux notification passthrough feature is complete, consistent, and well-documented"}}
{"run":62,"commit":"1377cb6","metric":1,"metrics":{"duration_s":19.1},"status":"keep","description":"Build: truncate notify-terminal title to 63 bytes and body to 255 bytes to match Ghostty's fixed-size notification buffers, avoiding unnecessarily long OSC 777 escape sequences.","timestamp":1779900621971,"segment":1,"confidence":null,"asi":{"Ghostty_buffers":"title[63:0]u8, body[255:0]u8 — showDesktopNotification uses @min to copy, silently dropping bytes beyond these limits","hypothesis":"Truncating title to 63 bytes and body to 255 bytes in notify-terminal avoids sending unnecessarily long OSC 777 escape sequences that Ghostty would silently truncate anyway","reduces_escape_size":"A 500-byte body now sends 255 bytes in the OSC instead of 500, reducing escape sequence overhead"}}
