{"run":1,"commit":"7e3629d","metric":0,"metrics":{},"status":"keep","description":"Build validation: copy-mode-cursor-ux-final tagged build succeeds (289s)","timestamp":1779691729784,"segment":0,"confidence":null,"asi":{"build_tag":"copy-mode-cursor-ux-final","duration_s":289,"app_path":"/Users/taylor/Library/Developer/Xcode/DerivedData/cmux-copy-mode-cursor-ux-final/Build/Products/Debug/cmux DEV copy-mode-cursor-ux-final.app"}}
{"run":2,"commit":"317ad1a","metric":1,"metrics":{},"status":"keep","description":"Build: bell notification passthrough - add TerminalNotificationStore.addNotification() calls to both app-level and surface-level GHOSTTY_ACTION_RING_BELL handlers. 3s cooldown per tab. Respects Claude Code hook suppression. Localized string added for notification body.","timestamp":1779723576827,"segment":0,"confidence":null,"asi":{"hypothesis":"Adding addNotification() call to GHOSTTY_ACTION_RING_BELL handlers will cause terminal bell events (printf '\\a', tmux bell alerts via monitor-bell) to create cmux native notifications, bridging the gap between Ghostty bell detection and cmux notification system.","build_tag":"bell-notification-passthrough","duration_s":221,"files_changed":["Sources/GhosttyTerminalView.swift","Resources/Localizable.xcstrings"],"app_path":"/Users/taylor/Library/Developer/Xcode/DerivedData/cmux-bell-notification-passthrough/Build/Products/Debug/cmux DEV bell-notification-passthrough.app"}}
{"run":3,"commit":"36be62f","metric":1,"metrics":{},"status":"keep","description":"Verification: clean working tree after bell notification passthrough implementation. Both app-level and surface-level GHOSTTY_ACTION_RING_BELL handlers now call addNotification() with 3s cooldown, Claude hook suppression, and localized body text.","timestamp":1779723682402,"segment":0,"confidence":null,"asi":{"hypothesis":"Implementation is complete and verified - no further code changes needed","files_changed":["Sources/GhosttyTerminalView.swift","Resources/Localizable.xcstrings"],"lines_added":43,"validation":"JSON valid, build passed, clean working tree"}}
{"type":"config","name":"Notification passthrough tmux routing build validation","metricName":"build_success","metricUnit":"","bestDirection":"higher"}
{"run":4,"commit":"c2b3df3","metric":1,"metrics":{"duration_s":85.1},"status":"keep","description":"Build: route `cmux notify` through caller-aware notification path so tmux invocations include pane metadata; document tmux OSC 777 limitation and direct CLI mechanism.","timestamp":1779732735774,"segment":1,"confidence":null,"asi":{"hypothesis":"Using the existing caller-aware notification.create_for_caller helper from `cmux notify` will attach tmux pane metadata and route rich notifications from processes inside tmux to the originating cmux pane, avoiding the payload-less forwarded bell path.","build_tag":"notification-passthrough-tmux-routing","validation":"./scripts/reload.sh --tag notification-passthrough-tmux-routing passed","files_changed":["CLI/cmux.swift","docs/notifications.md"]}}
{"run":5,"commit":"1a662e8","metric":1,"metrics":{"duration_s":80.7},"status":"keep","description":"Build: improve `cmux notify` ergonomics for tmux-safe rich notifications by accepting `--message` and positional body text while preserving caller-aware tmux pane routing.","timestamp":1779732951858,"segment":1,"confidence":null,"asi":{"hypothesis":"Lowering friction for arbitrary scripts and CLIs inside tmux makes the socket-based rich notification path more broadly usable than OSC/bell forwarding; accepting `cmux notify --title X 'body'` and `--message` keeps routing through caller-aware tmux metadata without requiring terminal escape sequences.","build_tag":"notification-passthrough-notify-ergonomics","validation":"./scripts/reload.sh --tag notification-passthrough-notify-ergonomics passed","files_changed":["CLI/cmux.swift","docs/notifications.md"],"next_action_hint":"Consider adding CI/VM behavioral coverage for `cmux notify --title X body` once socket CLI tests are run in the approved environment."}}
{"run":6,"commit":"pending","metric":0,"metrics":{"duration_s":23},"status":"crash","description":"Build crash: attempted tmux bridge hooks using bundled CLI path, but xcodebuild failed while resolving binary package artifacts due disk-full/truncated Sentry/Sparkle extraction before compiling the change.","timestamp":1779734242928,"segment":1,"confidence":null,"asi":{"hypothesis":"Installing tmux bridge hooks with an absolute bundled/current cmux CLI path would make alert forwarding robust even when tmux hook execution has a different PATH.","rollback_reason":"Build infrastructure failed during SwiftPM binary artifact extraction with write error (disk full?) before code compilation; experiment result is invalid and changes were reverted by autoresearch.","next_action_hint":"Free or reuse package artifact cache / derived data, then retry the same low-risk CLI hook path change.","error_detail":"xcodebuild exit 74: failed extracting Sentry and Sparkle xcframework zip artifacts; write error (disk full?), fatalError","build_tag":"notification-passthrough-tmux-hook-cli-path","files_changed":["CLI/cmux.swift","docs/notifications.md"]}}
{"run":7,"commit":"408600d","metric":1,"metrics":{"duration_s":79.4},"status":"keep","description":"Build: make installed tmux bridge hooks use cmux's bundled/current CLI path instead of relying on `cmux` being on tmux hook PATH.","timestamp":1779734408085,"segment":1,"confidence":null,"asi":{"hypothesis":"Using an absolute bundled/current cmux CLI path in managed tmux alert hooks makes notification forwarding more reliable for processes inside tmux, because hooks can still call `cmux hooks feed` when tmux's noninteractive PATH cannot resolve `cmux`.","build_tag":"notification-passthrough-notify-ergonomics","validation":"./scripts/reload.sh --tag notification-passthrough-notify-ergonomics passed using existing derived data cache after prior disk-full artifact extraction crash","files_changed":["CLI/cmux.swift","docs/notifications.md"],"retry_of_run":6}}
{"run":8,"commit":"86bcb4c","metric":1,"metrics":{"duration_s":21},"status":"keep","description":"Build: embed the current cmux socket path in installed tmux bridge hooks so alert forwarding does not depend on tmux preserving `CMUX_SOCKET_PATH`.","timestamp":1779734536057,"segment":1,"confidence":null,"asi":{"hypothesis":"Embedding `--socket <current CMUX_SOCKET_PATH>` in managed tmux bridge hooks makes notification forwarding more robust for long-lived tmux servers and noninteractive hook shells whose environment may lose cmux variables, while preserving the absolute CLI path fallback from the previous iteration.","build_tag":"notification-passthrough-notify-ergonomics","validation":"./scripts/reload.sh --tag notification-passthrough-notify-ergonomics passed","files_changed":["CLI/cmux.swift","docs/notifications.md"]}}
{"run":9,"commit":"216f339","metric":1,"metrics":{"duration_s":20},"status":"keep","description":"Build: let `cmux notify` use piped stdin as the notification body when no explicit body argument is provided, improving tmux-safe rich notification ergonomics for shell pipelines.","timestamp":1779734678043,"segment":1,"confidence":null,"asi":{"hypothesis":"Allowing `make 2>&1 | cmux notify --title ...` to read stdin makes the socket-based rich notification path easy for arbitrary scripts inside tmux and avoids OSC/bell payload loss without adding process-specific integrations.","build_tag":"notification-passthrough-notify-ergonomics","validation":"./scripts/reload.sh --tag notification-passthrough-notify-ergonomics passed","files_changed":["CLI/cmux.swift","docs/notifications.md"]}}
{"run":10,"commit":"8c07ed6","metric":1,"metrics":{"duration_s":28.8},"status":"keep","description":"Build: include tmux pane title and window name in managed tmux bridge notifications for richer context when only tmux alert hooks are available.","timestamp":1779734849943,"segment":1,"confidence":null,"asi":{"hypothesis":"Even when tmux consumes OSC notification payloads, tmux often retains pane title/window-name context. Forwarding that metadata through managed alert hooks gives cmux notifications more meaningful content than a generic bell/activity message without modifying Ghostty or relying on process-specific integrations.","build_tag":"notification-passthrough-notify-ergonomics","validation":"./scripts/reload.sh --tag notification-passthrough-notify-ergonomics passed","files_changed":["CLI/cmux.swift","docs/notifications.md"]}}
{"run":11,"commit":"2fd5ca7","metric":1,"metrics":{"duration_s":30.8},"status":"keep","description":"Build: include tmux pane current directory in managed tmux bridge notification bodies for additional context when OSC notification payloads are unavailable.","timestamp":1779734990761,"segment":1,"confidence":null,"asi":{"hypothesis":"When tmux consumes rich OSC notification payloads, pane_current_path is still available from tmux hook formats and helps users identify which project/worktree emitted the bell or activity alert without needing Ghostty changes.","build_tag":"notification-passthrough-notify-ergonomics","validation":"./scripts/reload.sh --tag notification-passthrough-notify-ergonomics passed","files_changed":["CLI/cmux.swift","docs/notifications.md"]}}
{"run":12,"commit":"d2b9cbc","metric":1,"metrics":{"duration_s":20.2},"status":"keep","description":"Build: cap piped stdin bodies for `cmux notify` before sending notifications over the socket, preventing accidental oversized notifications from large command logs.","timestamp":1779735122250,"segment":1,"confidence":null,"asi":{"hypothesis":"Piped command output is useful for tmux-safe rich notifications, but unbounded stdin can turn large logs into oversized socket payloads and notification bodies. Capping stdin keeps the general workflow safe without weakening explicit --body/positional usage.","build_tag":"notification-passthrough-notify-ergonomics","validation":"./scripts/reload.sh --tag notification-passthrough-notify-ergonomics passed","files_changed":["CLI/cmux.swift","docs/notifications.md"]}}
{"run":13,"commit":"b088af2","metric":1,"metrics":{"duration_s":18.3},"status":"keep","description":"Build: preserve the tail of piped stdin for `cmux notify` instead of the head when truncating large command output, so notifications show the most recent log context.","timestamp":1779735243954,"segment":1,"confidence":null,"asi":{"hypothesis":"For tmux-safe notifications fed from command pipelines, the tail of a large log usually contains the actionable failure/success context. Keeping the last 16 KB maintains bounded socket payloads while making stdin notifications more useful than head-only truncation.","build_tag":"notification-passthrough-notify-ergonomics","validation":"./scripts/reload.sh --tag notification-passthrough-notify-ergonomics passed","files_changed":["CLI/cmux.swift","docs/notifications.md"]}}
{"run":14,"commit":"6741268","metric":1,"metrics":{"duration_s":19},"status":"keep","description":"Build: support explicit stdin body syntax for `cmux notify --body -` and `--message -`, matching common CLI conventions for tmux-safe rich notifications.","timestamp":1779735367509,"segment":1,"confidence":null,"asi":{"hypothesis":"Adding explicit `--body -` / `--message -` support makes the socket-based notification path easier to integrate into existing shell scripts that use dash as stdin convention, while reusing the capped tail-reading behavior from prior iterations.","build_tag":"notification-passthrough-notify-ergonomics","validation":"./scripts/reload.sh --tag notification-passthrough-notify-ergonomics passed","files_changed":["CLI/cmux.swift","docs/notifications.md"]}}
{"run":15,"commit":"f9fe8ca","metric":1,"metrics":{"duration_s":19.3},"status":"keep","description":"Build: add `cmux notify --body-file <path|->` so scripts can send rich tmux-safe notifications from log files while reusing capped tail reads.","timestamp":1779735504753,"segment":1,"confidence":null,"asi":{"hypothesis":"Many scripts already write logs to files rather than pipelines. Supporting `--body-file` gives a process-agnostic tmux-safe notification path for those scripts, preserving recent output via the same last-16KB cap used for stdin.","build_tag":"notification-passthrough-notify-ergonomics","validation":"./scripts/reload.sh --tag notification-passthrough-notify-ergonomics passed","files_changed":["CLI/cmux.swift","docs/notifications.md"]}}
{"run":16,"commit":"59d5583","metric":1,"metrics":{"duration_s":19.2},"status":"keep","description":"Build: optimize `cmux notify --body-file` for large regular files by seeking directly to the last 16 KB instead of streaming the whole file.","timestamp":1779735666236,"segment":1,"confidence":null,"asi":{"hypothesis":"Since notification file bodies intentionally preserve only recent output, regular log files can be tailed directly with FileHandle.seek rather than fully streamed. This keeps the tmux-safe log-file notification workflow scalable for large build logs without changing observable body limits.","build_tag":"notification-passthrough-notify-ergonomics","validation":"./scripts/reload.sh --tag notification-passthrough-notify-ergonomics passed","files_changed":["CLI/cmux.swift"]}}
{"run":17,"commit":"4327a97","metric":1,"metrics":{"duration_s":19.4},"status":"keep","description":"Build: add `cmux notify --body-max-bytes` to tune capped stdin/file notification body size while enforcing a 64 KB socket-payload ceiling.","timestamp":1779735820695,"segment":1,"confidence":null,"asi":{"hypothesis":"Different scripts need different amounts of log context. A bounded `--body-max-bytes` option keeps socket payloads safe while letting tmux-safe notifications include shorter or richer stdin/file tails as appropriate.","build_tag":"notification-passthrough-notify-ergonomics","validation":"./scripts/reload.sh --tag notification-passthrough-notify-ergonomics passed","files_changed":["CLI/cmux.swift","docs/notifications.md"]}}
{"run":18,"commit":"dbb532a","metric":1,"metrics":{"duration_s":19.4},"status":"keep","description":"Build: make explicit stdin notification bodies (`--body -`, `--message -`, `--body-file -`) fail fast on terminal stdin instead of silently sending an empty body or blocking.","timestamp":1779735950653,"segment":1,"confidence":null,"asi":{"hypothesis":"Explicit dash stdin means the caller expects piped or redirected content. Failing fast when stdin is a terminal prevents confusing empty notifications for `--body -` and avoids interactive hangs for `--body-file -`, improving script ergonomics for tmux-safe notifications.","build_tag":"notification-passthrough-notify-ergonomics","validation":"./scripts/reload.sh --tag notification-passthrough-notify-ergonomics passed","files_changed":["CLI/cmux.swift","docs/notifications.md"]}}
{"run":19,"commit":"fb9cec7","metric":1,"metrics":{"duration_s":18.9},"status":"keep","description":"Build: include tmux pane/window context directly in managed bridge notification titles, so alerts are meaningful even before reading the body.","timestamp":1779736061496,"segment":1,"confidence":null,"asi":{"hypothesis":"The original tmux problem included an unhelpful title like `tmux`. Managed tmux bridge alerts already forward pane/window metadata, so folding that context into the notification title makes bell/activity/silence alerts recognizable at a glance without relying on body expansion.","build_tag":"notification-passthrough-notify-ergonomics","validation":"./scripts/reload.sh --tag notification-passthrough-notify-ergonomics passed","files_changed":["CLI/cmux.swift","docs/notifications.md"]}}
{"run":20,"commit":"ed2333d","metric":1,"metrics":{"duration_s":18.5},"status":"keep","description":"Build: keep tmux bridge notification titles concise by truncating pane/window context to 80 characters while preserving full context in the body.","timestamp":1779736173508,"segment":1,"confidence":null,"asi":{"hypothesis":"Adding pane/window context to tmux bridge notification titles improves recognizability, but unbounded pane titles can make macOS notifications noisy. Truncating only the title context keeps alerts glanceable while retaining full metadata in the body.","build_tag":"notification-passthrough-notify-ergonomics","validation":"./scripts/reload.sh --tag notification-passthrough-notify-ergonomics passed","files_changed":["CLI/cmux.swift","docs/notifications.md"]}}
{"run":21,"commit":"75aa0fd","metric":1,"metrics":{"duration_s":19.4},"status":"keep","description":"Build: use tmux pane/window/command metadata as the default `cmux notify` title inside tmux when `--title` is omitted, avoiding generic Notification titles.","timestamp":1779736304799,"segment":1,"confidence":null,"asi":{"hypothesis":"The original tmux issue produced unhelpful titles such as `tmux`. For direct `cmux notify` calls without an explicit title, tmux already exposes pane/window/command metadata; using that as a fallback keeps notifications meaningful without requiring every script to provide a title.","build_tag":"notification-passthrough-notify-ergonomics","validation":"./scripts/reload.sh --tag notification-passthrough-notify-ergonomics passed","files_changed":["CLI/cmux.swift","docs/notifications.md"]}}
{"run":22,"commit":"1c7b6f3","metric":1,"metrics":{"duration_s":19.4},"status":"keep","description":"Build: reuse concise 80-character tmux metadata title handling for direct `cmux notify` default titles inside tmux.","timestamp":1779736429982,"segment":1,"confidence":null,"asi":{"hypothesis":"The previous default-title fallback for direct `cmux notify` inside tmux could inherit arbitrarily long pane/window titles. Reusing the concise title context logic keeps both direct and bridge notifications glanceable while preserving meaningful tmux metadata.","build_tag":"notification-passthrough-notify-ergonomics","validation":"./scripts/reload.sh --tag notification-passthrough-notify-ergonomics passed","files_changed":["CLI/cmux.swift","docs/notifications.md"]}}
{"run":23,"commit":"0be14a4","metric":1,"metrics":{"duration_s":19.5},"status":"keep","description":"Build: use tmux session/window/pane location as the default `cmux notify` subtitle inside tmux when `--subtitle` is omitted.","timestamp":1779736557785,"segment":1,"confidence":null,"asi":{"hypothesis":"Direct `cmux notify` calls inside tmux now get better default titles, but notifications still lose location context if the script omits `--subtitle`. Filling the subtitle from tmux session/window/pane metadata makes routed notifications easier to identify without requiring script-specific integrations.","build_tag":"notification-passthrough-notify-ergonomics","validation":"./scripts/reload.sh --tag notification-passthrough-notify-ergonomics passed","files_changed":["CLI/cmux.swift","docs/notifications.md"]}}
{"run":24,"commit":"771ebdf","metric":1,"metrics":{"duration_s":19.6},"status":"keep","description":"Build: add tmux command/current-directory fallback body for direct `cmux notify` calls inside tmux when no body content is provided.","timestamp":1779736698467,"segment":1,"confidence":null,"asi":{"hypothesis":"A direct `cmux notify` call inside tmux with no body can still be useful if it carries command and directory context from tmux. This avoids empty notification bodies and gives generic scripts a meaningful, process-agnostic fallback without touching Ghostty or relying on OSC payloads.","build_tag":"notification-passthrough-notify-ergonomics","validation":"./scripts/reload.sh --tag notification-passthrough-notify-ergonomics passed","files_changed":["CLI/cmux.swift","docs/notifications.md"]}}
{"run":25,"commit":"pending","metric":0,"metrics":{"duration_s":9.7},"status":"crash","description":"Build crash: attempted to batch direct tmux notify metadata defaults into one tmux query, but Swift compile failed due optional output handling before validation.","timestamp":1779736862061,"segment":1,"confidence":null,"asi":{"hypothesis":"Batching pane/window/command/session/path metadata into one tmux display-message call would reduce process launches for direct `cmux notify` defaults inside tmux.","rollback_reason":"Swift compile error: optional String from runTmuxForHook handling was not unwrapped before components(separatedBy:).","next_action_hint":"Retry the same optimization with explicit fallback `?? \"\"` before splitting the tmux output.","error_detail":"CLI/cmux.swift:11084:86 error: value of optional type 'String?' must be unwrapped to refer to member 'components'","build_tag":"notification-passthrough-notify-ergonomics","files_changed":["CLI/cmux.swift","docs/notifications.md"]}}
{"run":26,"commit":"e64cbc3","metric":1,"metrics":{"duration_s":19.1},"status":"keep","description":"Build: batch direct tmux `cmux notify` default title/subtitle/body metadata into a single `tmux display-message` query.","timestamp":1779736968009,"segment":1,"confidence":null,"asi":{"hypothesis":"Direct `cmux notify` defaults inside tmux now use pane/window/command/session/path metadata, but fetching each field separately launches several tmux processes. Batching the metadata into one display-message call preserves behavior while reducing overhead for scripts that omit title/subtitle/body.","build_tag":"notification-passthrough-notify-ergonomics","validation":"./scripts/reload.sh --tag notification-passthrough-notify-ergonomics passed after retry with optional output fallback","files_changed":["CLI/cmux.swift","docs/notifications.md"],"retry_of_run":25}}
